"1","…………。","…………。","…………。"
"2","……へえ！　正解だ！\nやるな三玖、成長がうかがえるぞ。","……hey！ That's the right answer！\nDon't do it, you can see growth。","……Ei！ Essa é a resposta certa！\nNão faça isso, você pode ver o crescimento。"
"3","……当たり前だ。\n俺はお前らの家庭教師なんだからな。","……It's natural。\nI'm your tutor。","……É natural。\nEu sou seu tutor。"
"4","あ、待ってください四葉。\nそれなら私が教えますよ、わかりますから。","Oh, please wait, Yotsuba。\nThen I'll tell you, because I understand。","Oh, por favor, espere, Yotsuba。\nEntão eu vou te dizer, porque eu entendo。"
"5","ああ、でしたら勉強ではありませんか？\n上杉君も交えて、いつもみんなでしていますよね。","Oh, isn't it a study？\nEveryone, including Uesugi-kun, is always there, isn't it？","Oh, não é um estudo？\nTodo mundo, incluindo Uesugi-kun, está sempre lá, não é？"
"6","ああ！\nテーマはもう決めてある、五つ子の日常だ！","Oh！\nThe theme has already been decided, it's the daily life of quintuplets！","Ah！\nO tema já foi decidido, é o cotidiano dos quíntuplos！"
"7","あはは……。\nみんなごめんね、撮影止めちゃって。","Aha ha……\nI'm sorry everyone stopped shooting。","Aha ha……\nSinto muito que todos pararam de atirar。"
"8","あー……それがあったわね……。","Ah……That was it……．","Ah……Foi isso……．"
"9","い、いや、別に……。","No, no, separately……。","Não, não, separadamente……。"
"10","いや、料理はあまり\nお前らの日常って感じじゃないな。\n二乃の日常じゃないか？","No, cooking is too much\nIt's not like your daily life。\nIsn't it Nino's daily life？","Não, cozinhar é demais\nNão é como sua vida diária。\nNão é a vida diária de Nino？"
"11","うむ！\nではせっかくだ、小テストでもしておこうか。\n問題なら今ここで作ってやるぞ！","Yeah！ It's a big deal at\n, let's do a quiz as well。\nIf it's a problem, I'll make it here and now！","Sim！ É um grande negócio em\n, vamos fazer um teste também。\nSe for um problema, eu vou fazer isso aqui e agora！"
"12","うわー……。\nテストを即興で作ってる人なんて初めて見た。","Wow……。\nI saw a person improvising a test for the first time。","Uau……。\nVi uma pessoa improvisando um teste pela primeira vez。"
"13","うん、そうだよ。\nフータロー君はもう私たちの『日常』の一部だもん。","Yeah, that's right。\nFutaro is already part of our “daily life。”","Sim, está certo。\nFutaro já faz parte do nosso “dia a dia”。"
"14","え……。","Eh,……。","Eh,……。"
"15","えーっと、フータロー君が\nすっかり張り切っちゃってるし、\n少しそれにつきあうのもいいかなー、なんて？","Well, Hootaro is completely enthusiastic about\n, and\nI wonder if it's okay to keep up with it？","Bem, Hootaro está completamente entusiasmado com\n, e\neu me pergunto se não há problema em acompanhá-lo？"
"16","えーと、まずは朝ご飯で、それから学校に行くよね。","Well, it's breakfast first, and then I'm going to school。","Bem, é café da manhã primeiro, e depois eu vou para a escola。"
"17","えー？　どうだったかしらねぇ？","Eh？ I wonder how it went, huh？","Eh？ Eu me pergunto como foi, hein？"
"18","お、見せてみろ。","Oh, show me","Oh, mostre-me"
"19","お、起きてきたか。","Oh, have you woken up？","Oh, você acordou？"
"20","おい、そこぉ！　何度言えばわかるんだ？\n無駄話をせずに問題に取り組めい！","Hey, that's it！ How many times should I say it？\nWork on problems without useless talk！","Ei, é isso aí！ Quantas vezes devo dizer isso？\nTrabalhe em problemas sem conversa inútil！"
"21","おはよ、ねぼすけ一花。","Good morning, Nebosuke Ichika","Bom dia, Nebosuke Ichika"
"22","おはよーございまーす……。","Good morning Mars……","Bom dia Marte……"
"23","お兄ちゃん、照れてる？","Is your brother shy？","Seu irmão é tímido？"
"24","こうやっておしゃべりしているだけじゃ、\n絵にならないもんね。","Just talking like this doesn't make a\n。","Só falar assim não faz uma\n。"
"25","これだけ濃いキャラをしている上杉君に\n慣れてしまうとは……\n人間の順応とは恐ろしいものです。","Uesugi-kun, who has such a strong character, is\naccustomed to……\nHuman acclimatization is horrible It's stuff。","Uesugi-kun, que tem um caráter tão forte, está\nacostumado a……\nA aclimatação humana é horrível。"
"26","これで勉強に３票だな。\nさて、二乃と三玖はどうする？","This is three votes for studying。\nWell, what do Nino and Miku do？","São três votos para estudar。\nBem, o que Nino e Miku fazem？"
"27","じゃあ、朝から順番に、\nいつもみんなでしてることを考えてみる？","So, in order from morning to\n, think about what we always do together？","Então, na ordem da manhã às\n, pense no que sempre fazemos juntos？"
"28","そうなったのって、一体いつからなんだろ？","When did that happen from when did it start？","Quando isso aconteceu a partir de quando começou？"
"29","そうねぇ。\nいきなり日常を見せろと言われても困るわ。","That's right。\nI'm in trouble if I'm suddenly told to show my daily life。","Está certo。\nEstou com problemas se de repente me disserem para mostrar minha vida diária。"
"30","そう言うらいはちゃんも、すごくニコニコしてるよ？\n勉強している私たちってそんなに面白い？","If you say that, Raiha-chan is also smiling a lot, isn't it？\nAre we studying so interesting？","Se você diz isso, Raiha-chan também está sorrindo muito, não é？\nEstamos estudando tão interessante？"
"31","その前に作らなくちゃ。\nだったら、料理をしているところも悪くないかしら。","I have to make it before that。 If it's\n, isn't it bad to cook too？","Eu tenho que fazer isso antes disso。 Se for\n, não é ruim cozinhar também？"
"32","では、一緒にご飯を食べるのはどうでしょう？\nまさに日常です！","So what about eating together？\nIt's just everyday！","Então, que tal comer juntos？\nÉ só todos os dias！"
"33","では撮影を再開しましょう。\n次のカメラマンは上杉君とらいはちゃんですね。","Let's resume shooting。\nThe next cameraman is Uesugi-kun and Raiha-chan。","Vamos retomar as filmagens。\nO próximo cameraman é Uesugi-kun e Raiha-chan。"
"34","でも、日常って言われても……\n何をすればいいのかよくわからない。","But even if it's called everyday life……\nI'm not sure what to do。","Mas mesmo que seja chamado de vida cotidiana……\n, não sei o que fazer。"
"35","ねえ、フータロー君。\nこれからも私たちの『日常』を守ってね。","Hey, Futaro\nPlease continue to protect our “daily life。”","Ei, Futaro\nPor favor, continue protegendo nossa “vida diária”。"
"36","ねえ、私もいい？\n同じ問題で引っかかったのよ。","Hey, can I too？\nI was caught with the same problem。","Ei, eu também posso？\nFui pego com o mesmo problema。"
"37","はあ……。\nわかったわよ、一花がいいのならいいわ。","huh,……。\nOkay, it's okay if Ichika is good。","hein,……。\nOk, tudo bem se Ichika for bom。"
"38","ふっふっふ、お前らにとっても\n勉強が日常化していたとはな！\nこんなに嬉しいことはないぞ！","Huh heh, I don't think\nstudy has become a daily routine for you guys too！\nI'm never so happy！","Huh heh, eu não acho que\nestudo se tornou uma rotina diária para vocês também！\nNunca estou tão feliz！"
"39","ふふっ！\nよろしくね、先生。","Huh！\nRegards, sir。","Huh！\nAtenciosamente, senhor。"
"40","ふふん、俺をなめるな。\n伊達にお前らの家庭教師をやってるわけじゃない。\nこのくらい、お茶の子さいさいってもんだ。","hey, don't lick me。\nIt's not like I'm tutoring you guys for Date。\nAbout this much, is Ochanoko Saitemoto","Ei, não me lamba。\nNão é como se eu estivesse ensinando vocês para o Date。\nSobre isso, é Ochanoko Saitemoto"
"41","ほら、一花もなんとか言いなさい！","Look, say something about Ichika too！","Olha, diga algo sobre Ichika também！"
"42","みんな、勉強なのに楽しそうだね～。\nすごく撮りがいがあるよ。","Everyone seems to be having fun even though they're studying。\nIt's really worthwhile to shoot。","Todo mundo parece estar se divertindo, mesmo estudando。\nRealmente vale a pena filmar。"
"43","も、申し訳ない……。","I'm sorry, too,……。","Sinto muito, também,……。"
"44","もちろんです！　任せてください。","Of course it is！ Please leave it to me。","Claro que é！ Por favor, deixe isso comigo。"
"45","もーっ！\n撮影会のはずが、なんで私たち勉強してるのよ！","Mooh！\nIt's supposed to be a photo session, but why are we studying！","Mooh！\nEra para ser uma sessão de fotos, mas por que estamos estudando！"
"46","やっぱり、お布団の魔力はすごいや。\n抵抗してたんだけどダメだったよ。","After all, the magic of futons is amazing。\nI was resisting, but it was useless。","Afinal, a magia dos futons é incrível。\nEu estava resistindo, mas foi inútil。"
"47","らいは","Raiha","Raiha"
"48","わからないけど、いつの間にか、ね。\n家の中にフー君がいるのに違和感がなくなってた。","I don't know, but before I knew it, right？\nThere was no sense of incongruity even though Fu-kun was in the house。","Eu não sei, mas antes que eu percebesse, certo？\nNão havia sensação de incongruência, mesmo que Fu-kun estivesse na casa。"
"49","ん、フータローのおかげだよ。","Hmm, it's thanks to Futaro。","Hmm, é graças a Futaro。"
"50","フータロー、さっきの問題できた。","Futaro, I got the problem just now。","Futaro, eu tenho o problema agora mesmo。"
"51","フータローが調子に乗ってる。","Futaro is getting on with it。","Futaro está se dando bem com isso。"
"52","ホント？　ありがと！\n五月の説明はわかりやすいから助かるー。","Is that true？ Thanks！\nThe explanation for May is easy to understand, so it's helpful。","Isso é verdade？ Obrigado！\nA explicação para maio é fácil de entender, por isso é útil。"
"53","ラベル0","Label 0","Rótulo 0"
"54","ラベル1","Label 1","Etiqueta 1"
"55","一花","Ichika","Ichika"
"56","一花がいいのでしたら、私は構いませんよ？","If Ichika is good, don't I care？","Se Ichika é boa, eu não me importo？"
"57","一花さんたちの『いつも』に、\nお兄ちゃんがいるんだなって嬉しくなるから。","It makes me happy that Ichihana-san's ""always"" has\nolder brother。","Fico feliz que o ""sempre"" de Ichihana-san tenha\nirmão mais velho。"
"58","一花の抵抗はささやかすぎると思う。","I think Ichika's resistance is too modest。","Acho que a resistência de Ichika é muito modesta。"
"59","三玖","Sankaku","Sankaku"
"60","上杉さーん。\nすみません、この問題がわかりません。","Uesugi san\nSorry, I don't understand this problem。","Uesugi san\nDesculpe, eu não entendo esse problema。"
"61","中","midst","meio"
"62","了解、みんなとの日常ね。","OK, it's a daily life with everyone。","OK, é uma vida diária com todos。"
"63","二乃","Nino","Nino"
"64","二乃、初めのうちは大変だったし。","Nino, it was tough in the beginning。","Nino, foi difícil no começo。"
"65","五月","May","Maio"
"66","人を珍獣みたいに言うな。","Don't call people like rare animals。","Não chame as pessoas de animais raros。"
"67","出右","Izu","Izu"
"68","出右遅","Dezuu Slow","Dezuu lento"
"69","出左","Izusa","Izusa"
"70","右外","Right outside","Do lado de fora"
"71","四葉","Yotsuba","Yotsuba"
"72","左","left","esquerdo"
"73","目がっかり:口がっかり:頬無し","Eyes disappointed: mouth disappointed: no cheeks","Olhos decepcionados: boca decepcionada: sem bochechas"
"74","目ときめき:口ときめき:頬ときめき","Eyes Crush: Mouth Crush: Cheek Crush","Esmagamento de olhos: Esmagamento na boca: esmagamento"
"75","目むくれ:口むくれ:頬むくれ","Swollen eyes: swollen mouth: swollen cheeks","Olhos inchados: boca inchada: bochechas inchadas"
"76","目むくれ:口むくれ:頬無し","Swollen eyes: swollen mouth: no cheeks","Olhos inchados: boca inchada: sem bochechas"
"77","目キョトン:口キョトン:頬無し","Eyes Kyoton: Mouth Kyoton: No cheeks","Olhos Kyoton: Boca Kyoton: Sem bochechas"
"78","目キョトン:口キョトン:頬無し:汗無し","Eyes Kyoton: Mouth Kyoton: No Cheeks: No Sweat","Olhos Kyoton: Boca Kyoton: Sem bochechas: Sem suor"
"79","目ニヤリ:口ニヤリ:頬無し","Eyes Grins: Mouth Grins: No Cheeks","Olhos sorrisos: boca sorri: sem bochechas"
"80","目作り笑い:口作り笑い:頬作り笑い","Eyes smirk: mouth smirk: cheek smirk","Olhos sorriem: sorriso na boca: sorriso na bochecha"
"81","目哀しみ:口哀しみ:頬無し","Eyes sadness: mouth sadness: no cheeks","Tristeza nos olhos: tristeza na boca: sem bochechas"
"82","目困惑:口困惑:頬無し","Eyes Puzzled: Mouth Puzzles: No Cheeks","Olhos intrigados: quebra-cabeças de boca: sem bochechas"
"83","目困惑:口困惑:頬無し:汗無し","Eye Puzzles: Mouth Puzzles: No Cheeks: No Sweat","Quebra-cabeças de olhos: quebra-cabeças de boca: sem bochechas: sem suor"
"84","目微笑:口微笑:頬微笑","Eyes smile: mouth smile: cheek smile","Olhos sorriem: sorriso na boca: sorriso na bochecha"
"85","目微笑:口微笑:頬無し","Eyes Smiling: Mouth Smiling: No Cheeks","Olhos sorrindo: boca sorrindo: sem bochechas"
"86","目微笑:口微笑:頬無し:汗無し","Eyes Smiling: Mouth Smiling: No Cheeks: No Sweat","Olhos sorrindo: boca sorrindo: sem bochechas: sem suor"
"87","目怒り:口怒り:頬無し","Eye anger: mouth rage: no cheek","Raiva ocular: raiva na boca: sem bochecha"
"88","目無表情:口無表情:頬無し","Eyes Expressionless: Mouth Expressionless: No Cheeks","Olhos sem expressão: boca sem expressão: sem bochechas"
"89","目照れ微笑:口照れ微笑:頬照れ微笑","Shy smile: shy smile: shy smile","Sorriso tímido: sorriso tímido: sorriso tímido"
"90","目笑顔:口笑顔:頬無し","Eyes Smile: Mouth Smile: No Cheeks","Sorriso de olhos: sorriso na boca: sem bochechas"
"91","目笑顔:口笑顔:頬無し:汗無し","Eyes Smile: Mouth Smile: No Cheeks: No Sweat","Sorriso de olhos: sorriso na boca: sem bochechas: sem suor"
"92","目笑顔:口笑顔:頬笑顔","Eyes Smile: Mouth Smile: Cheek Smile","Sorriso de olhos: sorriso na boca: sorriso na bochecha"
"93","目苦笑:口苦笑:頬無し","A bitter smile: a bitter mouth smile: no cheeks","Um sorriso amargo: um sorriso amargo na boca: sem bochechas"
"94","目通常:口通常:頬無し","Eyes Normal: Mouth Normal: No Cheeks","Olhos normais: boca normal: sem bochechas"
"95","目通常:口通常:頬無し:汗無し","Eyes Normal: Mouth Normal: No Cheeks: No Sweat","Olhos normais: boca normal: sem bochechas: sem suor"
"96","確かに。","Certainly。","Certamente。"
"97","私たちにとってはすごく嫌な特技だなぁ。","It's a very disgusting special skill for us。","É uma habilidade especial muito nojenta para nós。"
"98","私にとっても復習になりますから。\nお互い様です。","It's going to be a review for me as well。\nIt's like each other。","Vai ser uma crítica para mim também。\nÉ como um ao outro。"
"99","私も。","Me too。","Eu também。"
"100","私もいいよ。\nこれ、すごく日常って感じがするし。","I'm good too。\nThis feels like a lot of everyday life。","Também estou bem。\nIsso parece muito com a vida cotidiana。"
"101","面白いってわけじゃなくて、\n見ててニコニコしちゃうんだ。\nだって――","It's not that it's funny, I'm smiling when I look at\n。\nCause","Não é que seja engraçado, estou sorrindo quando olho para\n。\nCausa"
"102","風太郎","Futaro","Futaro"
"103","黙ってらんないわよ！\nテストに合格したんだから、\n勉強のことは忘れるはずじゃなかったの！？","I'm not going to shut up！ I passed the\ntest, so\nWasn't you supposed to forget about studying！？","Eu não vou calar a boca！ Eu passei no teste\n, então\nVocê não deveria esquecer de estudar！？"