"1","…………。","…………。","…………。"
"158","私は、フータローのためだけに\n料理を勉強したいのかもしれない。","Maybe I want to study\ncooking just for Futaro。","Talvez eu queira estudar\nculinária só para Futaro。"
"159","私は、三玖が自分で納得しているのならば\nどんな進路でもいいと思います。","I think that if Miku is convinced by himself,\nany course is fine。","Eu acho que se Miku está convencido por si mesmo,\nqualquer curso está bem。"
"160","私も。\nというか、二乃も含めてみんなそうだよね。\nこれじゃアドバイスにはならないか。","Me too。\nor rather, everyone, including Nino, is not it？\nIsn't this going to be advice？","Eu também。\nou melhor, todo mundo, incluindo Nino, não é？\nIsso não vai ser um conselho？"
"161","立ち上がり速","Rise speed","Velocidade de subida"
"162","見当たらないね。\nもう山まで帰っちゃったのかも。","I can't find it。\nMaybe I've already gone back to the mountain。","Não consigo achar。\nTalvez eu já tenha voltado para a montanha。"
"163","言うまでもないけど、\nフー君のお嫁さんは却下！　だから。","Needless to say,\nFu's wife is rejected！ That's why。","Escusado será dizer que a esposa de\nFu é rejeitada！ É por isso。"
"164","追いかけてなんてないって！\n私はただ日課のランニングをしてただけだから。","I'm not chasing you！\nBecause I was just doing my daily routine of running。","Não estou te perseguindo！\nPorque eu estava apenas fazendo minha rotina diária de corrida。"
"165","逃げたりなんてしないから……。","I don't run away, so……。","Eu não fujo, então……。"
"166","進学するなら止める気ないけど、\nここでフー君のためでもいいんだって\n三玖を納得させる理由もないわ。","I'm not going to stop if I'm going to college, but\nsays it's okay for Fu-kun here\nThere's no reason to convince Miku。","Eu não vou parar se eu for para a faculdade, mas\ndiz que está tudo bem para Fu-kun aqui\nNão há razão para convencer Miku。"
"167","風太郎","Futaro","Futaro"
"168","（そうだよね。\n　たぶん、一花は空気を変えようとしてくれたんだ。\n　あんまり思い詰めないようにって）","（That's right。\nMaybe Ichika tried to change the air。 （\nDon't think too much about it）","（Está certo。\nTalvez Ichika tenha tentado mudar o ar。 （\nNão pense muito sobre isso）"
"169","？？？","？？？","？？？"