"1","…………。","…………。","…………。"
"2","……あいつらから聞いた。\nお前が悩んでいたことについてな。","……I heard from them。\nAbout what you were worried about。","……Eu ouvi deles。\nSobre o que você estava preocupado。"
"3","……それが？","……is that？","……é isso？"
"4","……わからないんだ。\nこのまま料理を続けていいのか。","……I don't know。\nCan I continue cooking as it is？","……Não sei。\nPosso continuar cozinhando como está？"
"5","……フータロー？\n何か用？","……Futaro？\nWhat is it for？","……Futaro？\nPara que serve？"
"6","……義務だと思ったことはないけど。","……I never thought it was a duty。","……Nunca pensei que fosse um dever。"
"7","……誰か１人のためだけに料理をしている、\nそういう自分のままでいいのかと悩んでいる――\nという話だったが、間違いないな？","……I'm cooking only for one person\nI'm worried about whether it's okay to be myself like that —\nIt was a story called, but there's no doubt about it？","……Estou cozinhando apenas para uma pessoa\nEstou preocupado se não há problema em ser eu mesmo assim -\nEra uma história chamada, mas não há dúvida sobre isso？"
"8","あ……。","Ah,……。","Ah,……。"
"9","あ、いや、待て待て！\nこの話には続きが……。","Oh no, wait, wait！\nThis story continues……。","Oh não, espere, espere！\nEsta história continua……。"
"10","いや、そもそも嫌になったのなら、\nはい止めました！　と、包丁でもなんでも\n放り出せばいい話だしな！","No, if you don't like it in the first place,\nis stopped！ It's a good story to throw out\nkitchen knife or anything！","Não, se você não gostar em primeiro lugar,\nestá parado！ É uma boa história jogar fora\nfaca de cozinha ou qualquer coisa！"
"11","ううん、いい。","No, that's good。","Não, isso é bom。"
"12","うん、そういう感じ。","Yeah, that's what it feels like。","Sim, é o que parece。"
"13","えっと……わからないって。","Um……I don't know。","Hum……não sei。"
"14","えっ？　な、なに？","Eh？ Wow, what？","Eh？ Uau, o quê？"
"15","え？　急に、なに？","Eh？ Suddenly, what？","Eh？ De repente, o quê？"
"16","こ、このまま料理を続けていいのか……。","Is it okay to continue cooking like this……？","Tudo bem continuar cozinhando assim……？"
"17","そうだ、『続けていいのか』と言ったんだ。","That's right, I said, 'Can I continue？ '","É isso mesmo, eu disse: 'Posso continuar？ '"
"18","そして金を稼げる職に就き、\nらいはに楽をさせてやるんだ！","Then I get a job where I can earn money, and let\nRaiha do it easy！","Então eu consigo um emprego onde posso ganhar dinheiro, e deixo\nRaiha fazer isso fácil！"
"19","そっか……。\nやっぱり、らいはちゃんのためだけじゃないんだ。","I see……。\nAfter all, Rai isn't just for Chan。","Eu vejo……。\nAfinal, Rai não é apenas para Chan。"
"20","その後だ！","After that！","Depois disso！"
"21","それは……その、なんだ。","That's……what is that。","Isso é……isso é o que。"
"22","そんなの、フータローにだって申し訳ないから。","That's because I'm sorry for Futaro。","Isso é porque eu sinto muito por Futaro。"
"23","そんな俺が勉強をする理由はいくつかあるが、\nまあ、まとめると俺の武器になり得るからだな。\n将来のための武器だ。","There are several reasons why I study like that, but\nWell, to sum it up, it's because it can be my weapon。\nIt's a weapon for the future。","Existem várias razões pelas quais eu estudo assim, mas\nBem, para resumir, é porque pode ser minha arma。\nÉ uma arma para o futuro。"
"24","ちなみに！\n俺の好きなことは勉強、趣味も特技も勉強で、\n全国模試３位という結果も出している。","By the way！\nMy favorite thing is studying, studying hobbies and special skills,\nThe result of being 3rd in the national mock exam has also come out。","A propósito！\nMinha coisa favorita é estudar, estudar hobbies e habilidades especiais,\nO resultado de ser o terceiro no exame simulado nacional também saiu。"
"25","ちょっと聞きたいことがあるんだ。\nドアを開けてくれないか？","There's something I'd like to ask you。\nCan you open the door for me？","Há algo que eu gostaria de te perguntar。\nVocê pode abrir a porta para mim？"
"26","つまりお前は、料理を続けたいんだな？","In other words, you want to continue cooking, don't you？","Em outras palavras, você quer continuar cozinhando, não é？"
"27","ともかくだ、お前は\n自分が料理を続けてもいい理由を\n探してるじゃないか？","Tomokaku, you're\nlooking for\nreason why you can continue cooking, right？","\n, você está procurando\nmotivo para continuar cozinhando, certo？"
"28","なに？","What is it？","O que é isso？"
"29","なんて……言ってたの？","What did you say……？","O que você disse……？"
"30","もののたとえだ。\n言葉尻を捕らえるんじゃない。","It's a parable of things。 Don't you catch the butt of\nwords。","É uma parábola das coisas。 Não pegue o alvo de\npalavras。"
"31","らいはちゃんに……。\nじゃあ、勉強して進学するのはらいはちゃんのため？","Raiha-chan is……。\nThen, is it because Raiha-chan is studying and going on to higher education？","Raiha-chan é……。\nEntão, é porque Raiha-chan está estudando e indo para o ensino superior？"
"32","わかったわかった、そう怒るな。","Okay, I understand, don't get so angry。","Ok, eu entendo, não fique com tanta raiva。"
"33","ストップ。","stop。","parar。"
"34","フータローだって同じだよ。\n私が言ったことをいちいち……。","It's the same for Futaro。\nEvery time I said……。","É o mesmo para Futaro。\nToda vez que eu disse……。"
"35","フータローに言われたから、じゃなくて\n自分でちゃんと答えを出したいから。\nでないと前に進めない。","Not because I was told by\n, but because I want to give an answer by myself。 If it is not\n, you cannot move forward。","Não porque\nme contou, mas porque quero dar uma resposta por mim mesmo。 Se não for\n, você não poderá avançar。"
"36","ラベル0","Label 0","Rótulo 0"
"37","三玖","Sankaku","Sankaku"
"38","三玖……？","Misaki……？","Misaki……？"
"39","中","midst","meio"
"40","今お前は、なんと言った？","What did you just say？","O que você acabou de dizer？"
"41","俺だ。","It's me","Sou eu"
"42","出右遅","Dezuu Slow","Dezuu lento"
"43","出左","Izusa","Izusa"
"44","勉強をし、より上位の大学への進学を目指すのも\n学歴で武器を強化するためと言える。","It can be said that the reason for studying and aiming to go on to a higher university is to strengthen the weapon with\neducational background。","Pode-se dizer que o motivo de estudar e almejar uma universidade superior é fortalecer a arma com\nformação educacional。"
"45","包丁を放り出したら危ない。","It's dangerous if you throw out a kitchen knife。","É perigoso se você jogar fora uma faca de cozinha。"
"46","右","right","certo"
"47","左","left","esquerdo"
"48","心配してくれてありがとう。\n……それじゃ。","Thank you for worrying me。\n……That's it。","Obrigado por me preocupar。\n……É isso aí。"
"49","料理が好きなんだろ？\n誰かのために、という義務でやってる\nわけじゃないよな？","You like cooking, don't you？ I'm doing it with the obligation of\nfor someone\nThat's not it, is it？","Você gosta de cozinhar, não é？ Estou fazendo isso com a obrigação de\npara alguém\nNão é isso, é isso？"
"50","無論それもある、というかそれが一番だ。\nだが、それだけのつもりはない。","Of course there is that, or rather, it's the best。\n, but that's not the only intention。","Claro que existe isso, ou melhor, é o melhor。\n, mas essa não é a única intenção。"
"51","目がっかり:口がっかり:頬無し","Eyes disappointed: mouth disappointed: no cheeks","Olhos decepcionados: boca decepcionada: sem bochechas"
"52","目むくれ:口むくれ:頬むくれ","Swollen eyes: swollen mouth: swollen cheeks","Olhos inchados: boca inchada: bochechas inchadas"
"53","目キョトン:口キョトン:頬無し","Eyes Kyoton: Mouth Kyoton: No cheeks","Olhos Kyoton: Boca Kyoton: Sem bochechas"
"54","目ニヤリ:口ニヤリ:頬無し","Eyes Grins: Mouth Grins: No Cheeks","Olhos sorrisos: boca sorri: sem bochechas"
"55","目哀しみ:口哀しみ:頬無し","Eyes sadness: mouth sadness: no cheeks","Tristeza nos olhos: tristeza na boca: sem bochechas"
"56","目困惑:口困惑:頬無し","Eyes Puzzled: Mouth Puzzles: No Cheeks","Olhos intrigados: quebra-cabeças de boca: sem bochechas"
"57","目微笑:口微笑:頬無し","Eyes Smiling: Mouth Smiling: No Cheeks","Olhos sorrindo: boca sorrindo: sem bochechas"
"58","目無表情:口無表情:頬無し","Eyes Expressionless: Mouth Expressionless: No Cheeks","Olhos sem expressão: boca sem expressão: sem bochechas"
"59","目照れ微笑:口照れ微笑:頬照れ微笑","Shy smile: shy smile: shy smile","Sorriso tímido: sorriso tímido: sorriso tímido"
"60","目真剣:口真剣:頬無し","Eye Serious: Serious Mouth: No Cheek","Olho sério: boca séria: sem bochecha"
"61","目苦笑:口苦笑:頬無し","A bitter smile: a bitter mouth smile: no cheeks","Um sorriso amargo: um sorriso amargo na boca: sem bochechas"
"62","目通常:口通常:頬無し","Eyes Normal: Mouth Normal: No Cheeks","Olhos normais: boca normal: sem bochechas"
"63","目驚き:口驚き:頬無し","Eye surprise: mouth surprise: no cheek","Surpresa ocular: surpresa na boca: sem bochecha"
"64","誰？","Who is it？","Quem é？"
"65","風太郎","Futaro","Futaro"
"66","！……","！……","！……"
"67","（……必要とされる人間になる、だからな）","（……Become a needed person, because）","（……Torne-se uma pessoa necessária, porque）"
"68","（だが、三玖。\n　お前は進みたいと思ってんだろ？）","（But it's three times。 （\nYou want to move on, don't you？）","（Mas é três vezes。 （\nVocê quer seguir em frente, não é？）"
"69","（ならば、家庭教師として\n　お前が進むべき先を示すのが俺の仕事だ！）","（Then, as a\n, it's my job to show you where you should go！）","（Então, como\n, é meu trabalho mostrar onde você deve ir！）"
"70","（前に進む、か。\n　確かにそうだな、好きなことに邁進する理由が\n　曇っちまったら……進めやしない）","（Go ahead, right？\nYes, that's right, if the reason for going forward is\ncloudy,……don't go forward）","（Vá em frente, certo？\nSim, isso mesmo, se o motivo de seguir em frente for\nnublado,……não vá em frente）"
"71","（談話室にいたらいはの話だと、\n　三玖は自分の部屋に戻ったらしいが……）","（According to the story of I was in the common room,\nMiku seems to have returned to his room……）","（De acordo com a história de eu estava na sala comunal,\nMiku parece ter retornado ao seu quarto……）"