"1","…………。","…………。","…………。"
"2","……ううん。","……yeah。","……Sim。"
"3","……うん、そうだよね。\nみんな、本当にありがとう。","……Yeah, that's right。\nThank you so much, everyone。","……Sim, está certo。\nMuito obrigado a todos。"
"4","……うん、わかった。","……Yeah, I understand。","……Sim, eu entendo。"
"5","……うん。\n本当にごめん、心配かけちゃって。","……yeah。\nI'm really sorry, I'm worried","……Sim。\nSinto muito, estou preocupado"
"6","……かもしれない。\nでもどうしても、私自身が納得できない。","It might be ……。\nBut by all means, I'm not convinced myself。","Pode ser ……。\nMas, por todos os meios, não estou convencido de mim mesmo。"
"7","……そう。","……Yes。","……Sim。"
"8","……っ！？","……！？","……！？"
"9","……ふふっ！","……huh！","……hein！"
"10","……まさか、そんな風に受け止められるとはね。\n予想してなかったわ。","……No way, I don't think it can be perceived like that。\nI didn't expect it。","……De jeito nenhum, não acho que possa ser percebido assim。\nEu não esperava isso。"
"11","……わかった。","I understand ……。","Eu entendo ……。"
"12","……心構え、みたいなところかな。\n二乃が言ったとおりなんだ。","……think it's a place like that。\nThat's exactly what Nino said。","……Acho que é um lugar assim。\nFoi exatamente isso que Nino disse。"
"13","あ、あれ？\n私とフータローの家は……。","Oh, is that？\nMy house and Futaro are……。","Oh aquilo？\nA casa de Hootaro e eu é……。"
"14","あ、そうだ！\n花嫁修業って考えたらいいんじゃない？","Oh, that's right！\nIsn't it good to think about bride training？","Oh, está certo！\nNão é bom pensar sobre o treinamento de noivas？"
"15","あ、そうです、三玖。\nあなたの悩みのこと、上杉君も気にしていますし\n伝えたほうが……。","Oh, that's right, Sanku。\nUesugi-kun also cares about your worries。\nIt's better to tell……。","Ah, isso mesmo, Sanku。\nUesugi-kun também se preocupa com suas preocupações\nÉ melhor contar……。"
"16","あ、もしかして……。","Oh, maybe it's……。","Ah, talvez……。"
"17","ああ、なるほどねぇ！\nそのままフータロー君のお嫁さんになればいいんだ。","Oh, I see！\nI just need to become Futaro's wife。","Oh, eu vejo！\nEu só preciso me tornar a esposa de Futaro。"
"18","ああ、もう逃がさない……。","Oh, I won't let you escape anymore……。","Oh, eu não vou deixar você ir mais……。"
"19","あう……。","Oh,……。","Conheça……。"
"20","あうっ……。","Ahhhhhh……","Ahhhhhh……"
"21","あちゃー。\n二乃、それ言っちゃう？","Oh, huh\nNino, will you say that？","Oh, huh\nNino, você vai dizer isso？"
"22","あと、一花。\n木の裏にいるのはわかってるから。","Also, Ichika。\nBecause I know it's behind the tree。","Além disso, Ichika。\nPorque eu sei que está atrás da árvore。"
"23","あはは、ごめんごめん。\nまさかここで三玖が妄想モードに入っちゃうとは\n思わなかったよ。","Aha, sorry, sorry。\nNo way is Miku going into delusional mode here\nI didn't think","Ah, desculpa, desculpa。\nDe jeito nenhum Miku está entrando em modo delirante aqui\nEu não pensei"
"24","あれ？　おーい、三玖？","Is that？ Hey, Sanko？","É isso？ Ei, Sanko？"
"25","あんたがそれを言う？\n心配するに決まってるじゃない。","Do you say that？\nIt's decided to worry, isn't it？","Você diz isso？\nDecidiu se preocupar, não é？"
"26","あんたね、どんな妄想してたわけ？","What kind of delusions were you doing？","Que tipo de delírios você estava fazendo？"
"27","いやぁ、ホントごめんね？\n話を脱線させちゃって。","Well, I'm really sorry, aren't you？ I'm going to derail episode\n","Bem, eu sinto muito, não é？ Vou descarrilar o episódio\n"
"28","うえっ！？\nそそそ、そんなことしてないよ？","Wow！？\nSooo, aren't you doing that？","Uau！？\nSooo, você não está fazendo isso？"
"29","うん……。\nありがとう、みんな。","Yeah……。\nThanks, guys。","Sim……。\nObrigado, pessoal。"
"30","うん、５人で一歩だけど今は充分でしょ。","Yeah, it's one step for 5 people, but now it's enough, isn't it？","Sim, é um passo para 5 pessoas, mas agora é o suficiente, não é？"
"31","うーん、きっと怒りはしないだろうけど、\n大学に行かないのは、上杉さんとしては\n複雑だろうね。","Hmm, I'm sure you won't get angry, but for Mr。 Uesugi, who doesn't go to\nuniversity\nIt's complicated, isn't it？","Hmm, tenho certeza que você não vai ficar com raiva, mas para o Sr。 Uesugi, que não vai para a universidade\n\nÉ complicado, não é？"
"32","え、えぇえええぇぇっ！？","Eh, yeah yeah yeah！？","Eh, sim, sim, sim！？"
"33","え、ええっ！？","Eh, eh！？","Eh, eh！？"
"34","ええっ！？\n一花までいたんですか？","Eh！？\nWas there even Ichika？","Eh！？\nHouve mesmo Ichika？"
"35","え？","Eh？","Eh？"
"36","おかえりフータロー。\nお仕事、おつかれさま。","Welcome home Futaro\nWork, Otsukare-sama","Bem-vindo a casa Futaro\nWork, Otsukare-sama"
"37","おっはよー、２人とも！\nこんなところで偶然だね～。","Whoa hey, both of you！\nIt's a coincidence in a place like this。","Ei, vocês dois！\nÉ uma coincidência em um lugar como este。"
"38","おやおや～？　そこにいるのは……。","Oh my gosh ~？ The people there are……。","Oh meu Deus ~？ As pessoas lá são……。"
"39","けど私、こうも言ったわよね？\nフー君のためだけに料理を覚えたいなら止めないって。","But I also said this, right？\nIf you want to learn to cook just for Fu-kun, don't stop。","Mas eu também disse isso, certo？\nSe você quer aprender a cozinhar só para Fu-kun, não pare。"
"40","ここなら、あの鳥もいるかと思ったのですが……。","I thought there would be that bird here too, but……。","Eu pensei que haveria aquele pássaro aqui também, mas……。"
"41","ごめん、なんかおかしくなってきちゃった。\nみんな心配性だなって。","I'm sorry, something has gone wrong。\nEveryone is worried","Sinto muito, algo deu errado。\nTodo mundo está preocupado"
"42","ご飯できてるよ。\nそれとも、先にお風呂にする？","I'm ready to eat。\nOr are you going to take a bath first？","Estou pronto para comer。\nOu você vai tomar banho primeiro？"
"43","しっかり受け止めるよ。\nなんでも話して。","I'll take it firmly。\nTalk about anything","Vou aceitar com firmeza。\nFale sobre qualquer coisa"
"44","じゃ、そろそろ別荘に戻ろうか。\nフータロー君たちが待ってるよ。","Well, let's go back to the villa soon。\nFutaro is waiting for you","Bem, vamos voltar para a vila em breve。\nFutaro está esperando por você"
"45","じゃあ、二乃はどう？","So what about Nino？","Então, e quanto ao Nino？"
"46","そ、そうです！\nいきなり、そんな、お嫁さんだなんて\n話が飛躍しすぎですよ！？","That's right！\nSuddenly, That's My Wife, Episode\nIt's too much of a leap！","Está certo！\nDe repente, essa é minha esposa, Episódio\nÉ um salto demais！"
"47","そうだったんですか……。","That's how it was……。","Foi assim……。"
"48","そうだな……じゃあ……。","That's right……then……。","É isso mesmo……e……。"
"49","そうだねー。\n私は三玖がどんな道に進んでも応援するけど、\nもっと色々な人の意見を聞いたほうがいいよ。","That's right。\nI will support Miku no matter what path he goes on, but\nYou should listen to more people's opinions。","Está certo。\nEu apoiarei Miku, não importa o caminho que ele siga, mas\nVocê deve ouvir a opinião de mais pessoas。"
"50","そうだよ、上杉さんのためだって立派な理由だよ。\n誰かのために頑張るのって悪いことじゃないよね？","That's right, it's a good reason for Mr。 Uesugi。\nIt's not a bad thing to do your best for someone, right？","Isso mesmo, é uma boa razão para o Sr。 Uesugi。\nNão é uma coisa ruim fazer o seu melhor por alguém, certo？"
"51","そそ、そ、そんなことしてない！","That's right, I didn't do that！","Isso mesmo, eu não fiz isso！"
"52","その、ダメってなんなのよ。","What is that, no good","O que é isso, não é bom"
"53","それに、まだ進学先を決めたわけでもないし。","Besides, I haven't decided where to go to school yet。","Além disso, ainda não decidi onde ir para a escola。"
"54","それにしても……。","Even so, it's……。","Mesmo assim, é……。"
"55","そんな、身勝手な気持ちのままで\n料理の道に進んでいいのかって……怖くなった。","…was afraid that…should go on the path of\ncooking with such selfish feelings。","……com medo de seguir o caminho de\ncom sentimentos tão egoístas。"
"56","そんな日課があるなんて初耳。","It's the first time I've heard of such a daily routine。","É a primeira vez que ouço falar dessa rotina diária。"
"57","たくさん悩みましょう。\n私たちも、いくらでも相談に乗りますから。","Let's worry a lot。\nWe are also willing to consult with you as much as you want。","Vamos nos preocupar muito。\nTambém estamos dispostos a consultá-lo o quanto você quiser。"
"58","たまたま、ジョギングコースの先に\n三玖と五月ちゃんがいたんだよね～。","It just so happened that there were\nMiku and Satsuki at the end of the jogging course。","Acontece que havia\nMiku e Satsuki no final do curso de jogging。"
"59","だ、ダメだよフータロー……。\nそんな、いきなり……困る……。","That's no good, Futaro……。\nThat's all of a sudden……I'm in trouble……。","Isso não é bom, Futaro……。\nIsso é de repente……Estou com problemas……。"
"60","だけど行きたくなくなったわけじゃない。\nただ、このままじゃダメだって感じて。","But that doesn't mean I don't want to go anymore。\nHowever, I felt that I can't leave it like this。","Mas isso não significa que eu não quero mais ir。\nNo entanto, senti que não posso deixar assim。"
"61","だったら、フータロー君のためだけに\n料理をしてても問題なしだよ。","If so, there's no problem even if you cook\ndishes just for Futaro。","Nesse caso, não há problema, mesmo se você cozinhar\npratos apenas para o Futaro。"
"62","ですが、これも難題ですね。\n料理と縁遠い私では、これと言った\nアドバイスもできません。","But this is also a difficult problem。\nI'm far from cooking, so I said this\nI can't give you advice either。","Mas isso também é um problema difícil。\nEstou longe de cozinhar, então eu disse isso\nTambém não posso te dar conselhos。"
"63","ですよね、三玖！","That's right, Mitsui！","Está certo, Mitsui！"
"64","でも、フータローは私たちの家庭教師で、\n大学進学のために頑張ってくれてる。\nだから、どう伝えたらいいのか……。","But Futaro is our tutor, and he does his best to go to\nuniversity。\nSo, how should I tell them……。","Mas Futaro é nosso tutor, e ele faz o seu melhor para ir para a\nuniversidade。\nEntão, como devo dizer a eles……。"
"65","でも、朝ご飯に遅れると困るし。","But I'm in trouble if I'm late for breakfast。","Mas estou com problemas se me atrasar para o café da manhã。"
"66","でも、私は四葉みたいに\nあとをつけてたわけじゃなくて、\nちゃんとジョギングしてたよ？","But I wasn't wearing\nafter Yotsuba, but\nWere you jogging properly？","Mas eu não estava usando\ndepois de Yotsuba, mas\nVocê estava correndo corretamente？"
"67","でも私はずっとフータローのことしか考えてない。\n作りながら、フータローが喜んでくれるところばかり\n想像してる。","But I've only been thinking about Futaro for a long time。\nThere are only places where Futaro is happy while making\nI'm imagining","Mas eu só estive pensando em Futaro por um longo tempo。\nSó existem lugares onde Futaro é feliz enquanto faz\nEstou imaginando"
"68","というか、偶然じゃないよね。\n別荘からずっと、草むらに隠れてついてきてたし。","Or rather, it's not a coincidence。\nI've been hiding in the grass all the time from the villa。","Ou melhor, não é uma coincidência。\nEu estive escondido na grama o tempo todo da vila。"
"69","どうもなにも……三玖の気持ち次第でしょ？","It all depends on the feelings of……Sanku, right？","Tudo depende dos sentimentos de……Sanku, certo？"
"70","どう？\n一晩考えて、少しは整理がついた？","How's it going？\nDid you think about it overnight and get a little organized？","Como está indo？\nVocê pensou sobre isso durante a noite e ficou um pouco organizado？"
"71","なら、私たちから、進学のことは伏せて、\nあんたが料理のことで悩んでるって伝えておく。\nそれでどう？","Then, we'll tell you that you're worried about going to school and\nyou're worried about cooking。\nHow's that？","Então, diremos que você está preocupado em ir para a escola e\nvocê está preocupado em cozinhar。\nComo é isso？"
"72","なーんだ、私のことも気づいてたんだ。\n三玖ってば鋭いなぁ。","What, were you aware of me too。\nMiku is sharp。","O que, você estava ciente de mim também。\nMiku é afiado。"
"73","はあ……。","huh,……。","hein,……。"
"74","はあ、まったくもう。","Oh, not at all。","Oh, de jeito nenhum。"
"75","はあっ？\nあんたなに言って……。","huh？\nWhat are you saying……。","hein？\nO que você está dizendo……。"
"76","はあ？\n別荘から全力で先回りしてたのはどこの誰よ。","Huh？\nWho was ahead of the villa with all their might。","Hã？\nQuem estava à frente da vila com todas as suas forças。"
"77","はい、追いかけてました。","Yes, I was chasing。","Sim, eu estava perseguindo。"
"78","はい。\n料理の学校に行きたいという想いに\n迷いが生じたのですよね。","Yes。\nI was at\nloss about my desire to go to a cooking school。","Sim。\nEu estava perdido quanto ao meu desejo de ir para\nescola de culinária。"
"79","はいはい、わかったわよ。","Yes, yes, I understand。","Sim, sim, eu entendo。"
"80","ひゃっ！？","Huh！？","Huh！？"
"81","まあ、花嫁修業のつもりで進学します、なんて\nフータロー君が知ったら、怒られるに決まってるしね。","Well, I'm going to school with the intention of bride training, if you know\nFutaro, you're going to get angry。","Bem, eu estou indo para a escola com a intenção de treinar noivas, se você sabe\nFutaro, você vai ficar com raiva。"
"82","みぃーくぅー？","Mieeeeeeeeeu？","Mieeeeeeeeu？"
"83","むしろ、二乃が言ってくれて、\n進学しちゃう前に考えることができて、よかった。","Rather, I'm glad that Nino told me and I was able to think about it before going to\n。","Em vez disso, estou feliz que Nino me disse e eu fui capaz de pensar sobre isso antes de ir para\n。"
"84","もう少し、もう少しだけ、鳥を探してみませんか？\n諦めるのは早いと思うんです！","Why don't you look for birds a little more, just a little more？\nI think it's too early to give up！","Por que você não procura pássaros um pouco mais, só um pouco mais？\nAcho que é muito cedo para desistir！"
"85","よかったぁ。\nなんとか一歩くらいは前進した感じ？","That was good。\nDo you feel like you've managed to move forward about one step？","Isso foi bom。\nVocê sente que conseguiu avançar cerca de um passo？"
"86","わかった。\nフータロー、このまま……。","I got it。\nFutaro, as it is……。","Eu entendi。\nFutaro, como é……。"
"87","んんんー、料理の勉強をする理由かぁ。","Hmm, is there a reason to study cooking？","Hmm, há algum motivo para estudar culinária？"
"88","フータロー……。","Futaro……","Futaro……"
"89","フータローのお嫁さん……。","Hootaro's wife……。","A esposa de Hootaro……。"
"90","ラベル0","Label 0","Rótulo 0"
"91","ラベル1","Label 1","Etiqueta 1"
"92","ラベル2","Label 2","Etiqueta 2"
"93","一花","Ichika","Ichika"
"94","一花まで……。\nその冗談はシャレになってないから。","Until one flower is……\nBecause that joke isn't crazy。","Até que uma flor seja……\nPorque essa piada não é loucura。"
"95","三玖","Sankaku","Sankaku"
"96","三玖……。","Sanko……","Sanko……"
"97","三玖は、根がすごく真面目だからね。\n他の人に申し訳ないって思っちゃうのかな。","That's because Miku's roots are very serious。\nI wonder if I'm sorry for other people。","Isso porque as raízes de Miku são muito sérias。\nEu me pergunto se sinto muito por outras pessoas。"
"98","三玖はどうだ？","What about Miku？","E quanto a Miku？"
"99","三玖？","Sanko？","Sanko？"
"100","上杉君がどう言うかはともかく、\nまだ答えを出すのは早いのでは？","Regardless of what Uesugi-kun says,\nisn't it still early to give an answer？","Independentemente do que Uesugi-kun diz,\nainda não é cedo para dar uma resposta？"
"101","中","midst","meio"
"102","二乃","Nino","Nino"
"103","二乃まで？\n朝ご飯はどうしたの？","Up to Nino？\nWhat happened to breakfast？","Até o Nino？\nO que aconteceu com o café da manhã？"
"104","五月","May","Maio"
"105","五月、そろそろ戻ろっか。","May, it's time to go back。","May, é hora de voltar。"
"106","人生なめてるだろ！\nなんて言われちゃいそう。","You're licking your life！ It seems like they're going to say\n。","Você está lambendo sua vida！ Parece que eles vão dizer\n。"
"107","今日はらいはちゃんとフー君に任せたわ。","I left Rai to Fu-kun properly today。","Eu deixei Rai para Fu-kun corretamente hoje。"
"108","俺は、お前がいいな。","You're good for me。","Você é bom para mim。"
"109","俺をその気にさせるお前が悪いんだぜ？\nまったく、可愛いやつだな。","It's bad for you to make me feel like that, isn't it？\nThat's a cute guy at all。","É ruim para você me fazer sentir assim, não é？\nIsso é um cara fofo em tudo。"
"110","全員、揃っちゃいました……。","Everyone is aligned……。","Todos estão alinhados……。"
"111","出右","Izu","Izu"
"112","出右速","Dezuyoku","Dezuyoku"
"113","出右遅","Dezuu Slow","Dezuu lento"
"114","出左","Izusa","Izusa"
"115","割といい考えだと思ったのに。","I thought it was a relatively good idea。","Achei que era uma ideia relativamente boa。"
"116","右","right","certo"
"117","右外","Right outside","Do lado de fora"
"118","四葉","Yotsuba","Yotsuba"
"119","四葉？","Yotsuba？","Yotsuba？"
"120","四葉？　どうしてここに？","Yotsuba？ Why are you here？","Yotsuba？ Por que você está aqui？"
"121","妄想してない！！","I'm not delusional！！","Não estou delirando！！"
"122","左","left","esquerdo"
"123","左外","Sadai","Sadai"
"124","帰ったぞ、三玖。","I'm back, Sanko。","Estou de volta, Sanko。"
"125","待って、二乃が責任を感じる必要ないから。\nいずれ必ずぶつかる問題だったんだ。","Wait, Nino doesn't have to feel responsible。\nIt was a problem that I would always hit。","Espere, Nino não precisa se sentir responsável。\nEra um problema que eu sempre acertava。"
"126","料理の学校に行くか、\n大学に進学するか、それとも他の道か……。\n幸いなことに、考える時間はまだ少しあります。","Go to a culinary school,\ngo to college, or another way……。\nFortunately, we still have a little time to think。","Vá para uma escola de culinária,\nvá para a faculdade ou de outra forma……。\nFelizmente, ainda temos um pouco de tempo para pensar。"
"127","料理学校で勉強して調理師になったら、\nフータロー以外の人にも喜んでもらえるように\nならないといけないのに。","If you study at a cooking school and become a cook, make people other than\nFutaro happy I have to be\n。","Se você estuda em uma escola de culinária e se torna cozinheiro, faça pessoas que não sejam\nFutaro felizes, eu tenho que ser\n。"
"128","昨日、私が将来のことで悩んでるって話はしたよね。","Yesterday, I told you that I'm worried about the future。","Ontem, eu disse que estou preocupado com o futuro。"
"129","正気に戻りなさいっ！","Go back to sanity！","Volte para a sanidade！"
"130","目がっかり:口がっかり:頬無し","Eyes disappointed: mouth disappointed: no cheeks","Olhos decepcionados: boca decepcionada: sem bochechas"
"131","目がっかり:口がっかり:頬無し:汗無し","Eyes disappointed: mouth disappointed: no cheeks: no sweat","Olhos decepcionados: boca decepcionada: sem bochechas: sem suor"
"132","目ときめき:口ときめき:頬ときめき","Eyes Crush: Mouth Crush: Cheek Crush","Esmagamento de olhos: Esmagamento na boca: esmagamento"
"133","目ときめき:口ときめき:頬ときめき:汗無し","Eyes Crush: Mouth Crush: Cheeks Crush: No Sweat","Esmagamento dos olhos: esmagamento da boca: esmagamento das bochechas:"
"134","目むくれ:口むくれ:頬むくれ","Swollen eyes: swollen mouth: swollen cheeks","Olhos inchados: boca inchada: bochechas inchadas"
"135","目キョトン:口キョトン:頬無し","Eyes Kyoton: Mouth Kyoton: No cheeks","Olhos Kyoton: Boca Kyoton: Sem bochechas"
"136","目キョトン:口キョトン:頬無し:汗無し","Eyes Kyoton: Mouth Kyoton: No Cheeks: No Sweat","Olhos Kyoton: Boca Kyoton: Sem bochechas: Sem suor"
"137","目作り笑い:口作り笑い:頬作り笑い","Eyes smirk: mouth smirk: cheek smirk","Olhos sorriem: sorriso na boca: sorriso na bochecha"
"138","目作り笑い:口作り笑い:頬作り笑い:汗作り笑い","Eyes smirk: mouth smirk: cheek smirk: sweat smirk","Olhos sorriem: sorriso na boca: sorriso na bochecha: sorriso de suor"
"139","目哀しみ:口哀しみ:頬無し","Eyes sadness: mouth sadness: no cheeks","Tristeza nos olhos: tristeza na boca: sem bochechas"
"140","目哀しみ:口哀しみ:頬無し:汗無し","Eyes sadness: mouth sadness: no cheeks: no sweat","Tristeza nos olhos: tristeza na boca: sem bochechas: sem suor"
"141","目困惑:口困惑:頬無し","Eyes Puzzled: Mouth Puzzles: No Cheeks","Olhos intrigados: quebra-cabeças de boca: sem bochechas"
"142","目困惑:口困惑:頬無し:汗無し","Eye Puzzles: Mouth Puzzles: No Cheeks: No Sweat","Quebra-cabeças de olhos: quebra-cabeças de boca: sem bochechas: sem suor"
"143","目微笑:口微笑:頬無し","Eyes Smiling: Mouth Smiling: No Cheeks","Olhos sorrindo: boca sorrindo: sem bochechas"
"144","目微笑:口微笑:頬無し:汗無し","Eyes Smiling: Mouth Smiling: No Cheeks: No Sweat","Olhos sorrindo: boca sorrindo: sem bochechas: sem suor"
"145","目怒り:口怒り:頬無し","Eye anger: mouth rage: no cheek","Raiva ocular: raiva na boca: sem bochecha"
"146","目無表情:口無表情:頬無し","Eyes Expressionless: Mouth Expressionless: No Cheeks","Olhos sem expressão: boca sem expressão: sem bochechas"
"147","目無表情:口無表情:頬無し:汗無し","Eyes expressionless: no mouth expressionless: no cheeks: no sweat","Olhos sem expressão: sem boca sem expressão: sem bochechas: sem suor"
"148","目照れ微笑:口照れ微笑:頬照れ微笑","Shy smile: shy smile: shy smile","Sorriso tímido: sorriso tímido: sorriso tímido"
"149","目真剣:口真剣:頬無し","Eye Serious: Serious Mouth: No Cheek","Olho sério: boca séria: sem bochecha"
"150","目笑顔:口笑顔:頬無し","Eyes Smile: Mouth Smile: No Cheeks","Sorriso de olhos: sorriso na boca: sem bochechas"
"151","目苦笑:口苦笑:頬無し","A bitter smile: a bitter mouth smile: no cheeks","Um sorriso amargo: um sorriso amargo na boca: sem bochechas"
"152","目苦笑:口苦笑:頬無し:汗無し","Smiling eyes: bitter mouth smile: no cheeks: no sweat","Olhos sorridentes: boca amarga sorriso: sem bochechas: sem suor"
"153","目通常:口通常:頬無し","Eyes Normal: Mouth Normal: No Cheeks","Olhos normais: boca normal: sem bochechas"
"154","目通常:口通常:頬無し:汗無し","Eyes Normal: Mouth Normal: No Cheeks: No Sweat","Olhos normais: boca normal: sem bochechas: sem suor"
"155","目驚き:口驚き:頬無し","Eye surprise: mouth surprise: no cheek","Surpresa ocular: surpresa na boca: sem bochecha"
"156","目驚き:口驚き:頬無し:汗無し","Eyes Surprise: Mouth Surprise: No Cheeks: No Sweat","Olhos surpresa: surpresa na boca: sem bochechas: sem suor"
"157","私たちを追いかけて来たんだ？","Did they come after us？","Eles vieram atrás de nós？"
