"1","…………。","…………。","…………。"
"2","……すまん。","……I'm sorry。","……Desculpa。"
"3","あからさまに怪しい。","It's outright suspicious。","É totalmente suspeito。"
"4","あの、本当にやれというのですか？","Um, do you really want to do it？","Hum, você realmente quer fazer isso？"
"5","い、いえ別になにも！　なにもありませんよ！","No, no, nothing else！ There's nothing there！","Não, não, nada mais！ Não há nada lá！"
"6","いや、しかしだな、\n本当に太っているようには見えないぞ？\n多少太っていても気にする必要はないだろ。","No, but that's right,\ndoesn't really look fat, right？\nYou don't have to worry about being a little fat, right？","Não, mas isso mesmo,\nrealmente não parece gordo, certo？\nVocê não precisa se preocupar em ser um pouco gordo, certo？"
"7","いや別にそんなことはないだろ。\n見た目には変わってないぞ\n実に健康的でいいじゃないかはははは。","No, that's not the case, is it？\nIt hasn't changed in appearance\nIt's really healthy Isn't it okay hahaha","Não, esse não é o caso, é？\nNão mudou na aparência\nÉ muito saudável Não está tudo bem hahaha"
"8","ううううう～！","Uuuuuuuuuu~！","Uuuuuuuuuuuu~！"
"9","うっ……。","Ugh……","Ugh……"
"10","え？","Eh？","Eh？"
"11","おいおい、それで本気なのか？\nサボって筋力が落ちているようだな！","Hey hey, are you serious about that？\nIt seems that skipping is losing muscle strength！","Ei, ei, você está falando sério sobre isso？\nParece que pular é perder força muscular！"
"12","お！　いいぞいいぞ少し上がってきた！\nその意気だっ！","Oh！ That's good, it's going up a bit！\nThat's the spirit！","Ah！ Isso é bom, está subindo um pouco！\nEsse é o espírito！"
"13","きゃあ！？\nう、うう、上杉君！？","Oh yeah！？\nWow, uh, Uesugi-kun！","Ah, sim！？\nUau, uh, Uesugi-kun！"
"14","ここでの生活じゃ、１つの小さな問題が\n命に関わることに発展する可能性だってあるんだ。","In life here, one small problem could develop into\nlife-threatening。","Na vida aqui, um pequeno problema pode evoluir para\nrisco de vida。"
"15","そう言ってサボる気か？\n怠慢は許せん！","Are you skipping by saying that？\nI can't tolerate negligence！","Você está pulando dizendo isso？\nNão posso tolerar negligência！"
"16","それよりダメってなんだ？\n何か問題が起きたのか？","What's worse than that？\nDid something go wrong？","O que é pior do que isso？\nAlgo deu errado？"
"17","そんなに連呼しないでくださいっ！","Please don't make so many consecutive calls！","Por favor, não faça tantas chamadas consecutivas！"
"18","そんなに驚くことないだろ、\n普通に声をかけただけなのに。","It's not that surprising, even though I just called out to\nnormally。","Não é tão surpreendente, mesmo que eu tenha chamado para\nnormalmente。"
"19","つまりサボっているわけか。","In other words, are they skipping？","Em outras palavras, eles estão pulando？"
"20","では、始めます。","Now, let's get started。","Agora, vamos começar。"
"21","で？　日課の運動って何をやるんだ？","In？ What do you do in your daily routine of exercise？","Em？ O que você faz em sua rotina diária de exercícios？"
"22","とにかくですね、島に来てから\n日課の運動をあまりしていないので\n心配になったんです。","\n, since I came to the island, I haven't done much exercise in my daily routine, so\nwas worried about one。","\n, desde que vim para a ilha, não tenho feito muito exercício na minha rotina diária, por isso\npreocupado com um。"
"23","どうしてあなたが仕切っているんですか。","Why are you partitioning it？","Por que você está particionando？"
"24","ぬうううう～！","Nuuuuuuuuuuu","Nuuuuuuuuuuu"
"25","はあ……。","huh,……。","hein,……。"
"26","はあ……。\nやっぱりこのままじゃダメです……。","huh,……。\nAfter all, it's not good to leave it like this……。","hein,……。\nAfinal, não é bom deixar assim……。"
"27","はあ……。\n本当にあなたという人は……。","huh,……。\nThe person who is really you is……。","hein,……。\nA pessoa que realmente é você é……。"
"28","ふうううう……！","Fuuuu……！","Fuuuu……！"
"29","ふぬううう～！","Huuuuuuuuuu~！","Huuuuuuuuuuu~！"
"30","ふーむ、だったら誰かが見張っていれば\nサボることもなくなるんじゃないか？","Hmm, if that's the case, if someone is watching, isn't it going to skip\n？","Hmm, se for esse o caso, se alguém estiver assistindo, não vai pular\n？"
"31","ふ？","huh？","hein？"
"32","も、もう無理ですぅ～！","Well, it's impossible anymore！","Bem, é impossível mais！"
"33","もういいですっ！\nあなたに見張られていると落ち着きません！","It's already good！\nI can't calm down when I'm being watched by you！","Já está bom！\nNão consigo me acalmar quando estou sendo vigiado por você！"
"34","よし、じゃあまずは腹筋からだ！","Okay, then let's start with abs！","Ok, então vamos começar com abdominais！"
"35","わかってます！\nいちいち指摘しないでください！","Do you know it！\nPlease don't point it out one by one！","Você sabe disso！\nPor favor, não aponte um por um！"
"36","わかりました！　言えばいいんですね！\n実は、ふ、ふ、ふ……！","I understand it！ I should just say it！\nActually, Fu, Fu……！","Eu entendo！ Eu deveria dizer isso！\nNa verdade, Fu, Fu……！"
"37","サボったつもりは。\n精神的に余裕がなかったんです。","Do you think I skipped\nI couldn't afford it mentally。","Você acha que eu pulei\nEu não podia pagar mentalmente。"
"38","ダメだ、１人の判断じゃ認識不足なこともある。\nとにかく言ってみろ。","That's no good, there are times when one person's judgment is lacking in recognition。\nJust say it","Isso não é bom, há momentos em que o julgamento de uma pessoa carece de reconhecimento。\nBasta dizer isso"
"39","ラベル0","Label 0","Rótulo 0"
"40","ラベル1","Label 1","Etiqueta 1"
"41","ラベル2","Label 2","Etiqueta 2"
"42","中","midst","meio"
"43","五月","May","Maio"
"44","何がダメだって？","What's bad？","O que é ruim？"
"45","何を甘えてるんだ！\nさあ、もう一度だ、お前の根性を見せてみろ！","What are you spoiling！\nCome on, once again, show me your guts！","O que você está estragando！\nVamos, mais uma vez, mostre-me sua coragem！"
"46","全然体が上がってないぞ！\nもっと力を込めていけ！","My body hasn't risen at all！\nPut more effort into it！","Meu corpo não subiu！\nColoque mais esforço nisso！"
"47","出右","Izu","Izu"
"48","出右遅","Dezuu Slow","Dezuu lento"
"49","出左","Izusa","Izusa"
"50","別に、本当に……\n体重が増えてしまったのかはわかりませんが――","Separately, really……\nI don't know if I've gained weight","Separadamente, realmente……\nNão sei se ganhei peso"
"51","勉強以外のこんなところまで\nあなたのお世話になる気はありませんっ！\n出ていってください！","To such a place other than studying\nI don't feel like taking care of you！\nPlease go out！","Para um lugar diferente de estudar\nNão tenho vontade de cuidar de você！\nPor favor, saia！"
"52","右","right","certo"
"53","大丈夫です、その心配はありません。","It's okay, don't worry about that。","Tudo bem, não se preocupe com isso。"
"54","太ってしまったと思ったんです！","I thought I was getting fat！","Eu pensei que estava engordando！"
"55","小さい声になったのはせめてもの抵抗か。\n無駄なことを。","Is it at least resistance that has become a low voice？\nUseless things。","É pelo menos a resistência que se tornou uma voz baixa？\nCoisas inúteis。"
"56","左","left","esquerdo"
"57","目がっかり:口がっかり:頬無し","Eyes disappointed: mouth disappointed: no cheeks","Olhos decepcionados: boca decepcionada: sem bochechas"
"58","目がっかり:口がっかり:頬無し:汗無し","Eyes disappointed: mouth disappointed: no cheeks: no sweat","Olhos decepcionados: boca decepcionada: sem bochechas: sem suor"
"59","目むくれ:口むくれ:頬むくれ:汗無し","Swollen eyes: swollen mouth: swollen cheeks: no sweat","Olhos inchados: boca inchada: bochechas inchadas: sem suor"
"60","目むくれ:口むくれ:頬無し:汗無し","Swollen Eyes: Swollen Mouth: No Cheeks: No Sweat","Olhos inchados: boca inchada: sem bochechas: sem suor"
"61","目キョトン:口キョトン:頬無し","Eyes Kyoton: Mouth Kyoton: No cheeks","Olhos Kyoton: Boca Kyoton: Sem bochechas"
"62","目キョトン:口キョトン:頬無し:汗無し","Eyes Kyoton: Mouth Kyoton: No Cheeks: No Sweat","Olhos Kyoton: Boca Kyoton: Sem bochechas: Sem suor"
"63","目哀しみ:口哀しみ:頬無し","Eyes sadness: mouth sadness: no cheeks","Tristeza nos olhos: tristeza na boca: sem bochechas"
"64","目哀しみ:口哀しみ:頬無し:汗無し","Eyes sadness: mouth sadness: no cheeks: no sweat","Tristeza nos olhos: tristeza na boca: sem bochechas: sem suor"
"65","目困惑:口困惑:頬無し","Eyes Puzzled: Mouth Puzzles: No Cheeks","Olhos intrigados: quebra-cabeças de boca: sem bochechas"
"66","目困惑:口困惑:頬無し:汗無し","Eye Puzzles: Mouth Puzzles: No Cheeks: No Sweat","Quebra-cabeças de olhos: quebra-cabeças de boca: sem bochechas: sem suor"
"67","目怒り:口怒り:頬無し","Eye anger: mouth rage: no cheek","Raiva ocular: raiva na boca: sem bochecha"
"68","目怒り:口怒り:頬無し:汗無し","Eye anger: mouth anger: no cheek: no sweat","Raiva ocular: raiva na boca: sem bochecha: sem suor"
"69","目無表情:口無表情:頬無し","Eyes Expressionless: Mouth Expressionless: No Cheeks","Olhos sem expressão: boca sem expressão: sem bochechas"
"70","目無表情:口無表情:頬無し:汗無し","Eyes expressionless: no mouth expressionless: no cheeks: no sweat","Olhos sem expressão: sem boca sem expressão: sem bochechas: sem suor"
"71","目真剣:口真剣:頬無し","Eye Serious: Serious Mouth: No Cheek","Olho sério: boca séria: sem bochecha"
"72","目真剣:口真剣:頬無し:汗無し","Eye Serious: Serious Mouth: No Cheeks: No Sweat","Olho sério: boca séria: sem bochechas: sem suor"
"73","目笑顔:口笑顔:頬無し:汗無し","Eyes Smile: Mouth Smile: No Cheeks: No Sweat","Sorriso de olhos: sorriso na boca: sem bochechas: sem suor"
"74","目苦笑:口苦笑:頬無し","A bitter smile: a bitter mouth smile: no cheeks","Um sorriso amargo: um sorriso amargo na boca: sem bochechas"
"75","目驚き:口驚き:頬無し:汗無し","Eyes Surprise: Mouth Surprise: No Cheeks: No Sweat","Olhos surpresa: surpresa na boca: sem bochechas: sem suor"
"76","着替えまでしておいてやらない気か？\nちゃんと見ててやるから。","Aren't you going to change clothes？\nI'll take a look at it properly。","Você não vai trocar de roupa？\nVou dar uma olhada nisso corretamente。"
"77","立ち上がり速","Rise speed","Velocidade de subida"
"78","腹筋運動やヨガです。","It's sit-ups and yoga。","É abdominais e ioga。"
"79","言葉に心がこもっていませんが。","I don't have a lot of heart in my words。","Eu não tenho muito coração em minhas palavras。"
"80","風太郎","Futaro","Futaro"
"81","（……ちょっと調子に乗りすぎてしまったか）","（……Did you get a little too sick？）","（……Você ficou um pouco doente？）"