"1","…………。","…………。","…………。"
"2","……おい。\n勉強を見てもらいたいと言われて来てみれば、\nこれは一体どういうことだ？","……hey\nIf you are told that you want to see your studies,\nWhat the hell does this mean？","……Ei\nSe lhe disserem que você quer ver seus estudos,\nO que diabos isso significa？"
"3","……そうか。\nでは、これ以上は追求しないことにしよう。","……is that so？\nNow, let's not pursue it any more。","……é assim？\nAgora, não vamos mais prosseguir com isso。"
"4","……それ、一花が言う？","……Is that what Ichika says？","……É isso que Ichika diz？"
"5","……なんで俺に聞くんだよ。","……Why do you ask me？","……Por que você me pergunta？"
"6","……フータローのケチ。","……Futaro's stinginess","……A mesquinhez de Futaro"
"7","……大変に盛り上がっていて結構だが、\n夏休みの課題をするんじゃなかったのか？","……It's fine to be very excited,\nDidn't you do summer vacation assignments？","……É bom estar muito animado,\nVocê não fez tarefas de férias de verão？"
"8","あ、ああ、なんだ？","Oh, oh, what is it？","Oh, oh, o que é isso？"
"9","あ、そうです！\n想い出といえば――","Oh, that's right！\nSpeaking of memories","Oh, está certo！\nFalando de memórias"
"10","あ、電話が。\nすみません、失礼しますね。","Oh, there's a phone call。\nExcuse me, excuse me。","Oh, há um telefonema。\nDesculpe-me, com licença。"
"11","あああああ……。\nこんな写真、いつ撮ってたんですか……。","Oh ah ah……。\nWhen were you taking photos like this……。","Ah ah ah……。\nQuando você estava tirando fotos como essa……。"
"12","あっ、もう！","Oh, already！","Oh, já！"
"13","あら、呼ぶなんてつもりはないわよ？\nだってそのときは隣に……ふふっ！","Oh, I'm not going to call you, are you？\nbecause at that time it's next to……Huh！","Oh, eu não vou te ligar, vai？\nporque naquele momento é próximo a……Huh！"
"14","い、いや、そんなことはないんだが。","No, no, that's not the case。","Não, não, esse não é o caso。"
"15","いえ、その、深い意味などなくてですね！？","No, it doesn't have a deep meaning！？","Não, não tem um significado profundo！？"
"16","うん、それもいいかも！\nネックレスとか、ティアラに使うとか。\nらいはちゃんにも見てもらえるもんね。","Yeah, that might be good too！\nDo you use it for necklaces or tiaras？\nRaiha-chan can see it too, isn't it？","Sim, isso pode ser bom também！\nVocê o usa para colares ou tiaras？\nRaiha-chan também pode ver, não é？"
"17","えっ！？","Eh！？","Eh！？"
"18","えー？\n今日はもうそんな気分じゃないよ。","Eh？\nI don't feel like that anymore today。","Eh？\nEu não me sinto mais assim hoje。"
"19","おっ、フータロー君やっと来たね？\nほらほら、今ならみんなの秘蔵写真を見放題だよ？","Whoa, Futaro has finally come, right？\nhey hey, now everyone's treasured photos are unlimited, right？","Uau, Futaro finalmente chegou, certo？\nEi, ei, agora as fotos preciosas de todos são ilimitadas, certo？"
"20","お世話になっております、お父さん！\nらいはの件はありがとうございました！","I'm indebted to you, Dad！ Thank you for the\nRaiha case！","Estou em dívida com você, pai！ Obrigado pelo caso\nRaiha！"
"21","こっちは花火したときのだね。\nおお、らいはちゃんが可愛く撮れてる～！","This is when there were fireworks。\nOh, are you taking cute pictures of Raiha~！","Foi quando houve fogos de artifício。\nOh, você está tirando fotos fofas de Raiha ~！"
"22","これからも励んでくれたまえ。\nそれでは失礼するよ。","Please continue to work hard from now on。\nThen excuse me。","Por favor, continue trabalhando duro a partir de agora。\nEntão, desculpe-me。"
"23","さあ、勉強するぞ！\nお前らを、全員揃って笑顔で卒業させてやる！","Come on, let's study！\nI'm going to make you all graduate with a smile！","Vamos lá, vamos estudar！\nEu vou fazer todos vocês se formarem com um sorriso！"
"24","しまっておくのももったいないですし、\nお守りとして、順番に持ち歩きますか？","It's a waste to store it away, and do you carry it around in order as a\namulet？","É um desperdício armazená-lo, e você o carrega em ordem como um amuleto\n？"
"25","しゃがみ遅","Crouch slow","Agachar devagar"
"26","そうすれば、らいはちゃんが\n遊びに来てくれたとき、一緒に見られるし。","That way, when Raiha-chan comes to play\n, we can watch them together。","Dessa forma, quando Raiha-chan vier jogar\n, podemos assisti-los juntos。"
"27","そうそう、参考までに聞いてるだけだもの。\nここはフー君の好きなほうでいいのよ？\nねえ、どっちが好き？","Oh yeah, I'm just listening to it for reference。\nIs it okay for Fu-kun to like here？\nHey, which one do you like better？","Ah, sim, só estou escutando para referência。\nEstá tudo bem para o Fu-kun gostar daqui？\nEi, qual você gosta mais？"
"28","それ、いいね。\n可愛いお皿の上に、小物と一緒に並べてさ。\nきっとらいはちゃんも喜んでくれるよ。","That's good。\nArrange them with small items on a cute plate。\nI'm sure Raiha-chan will be happy too。","Isso é bom。\nOrganize-os com pequenos itens em um prato bonito。\nTenho certeza de que Raiha-chan também ficará feliz。"
"29","それはよかった。","That was good。","Isso foi bom。"
"30","だから……聞く相手を間違えてるぞ。","That's why……I'm listening to the wrong person。","É por isso que……estou ouvindo a pessoa errada。"
"31","ちょっと騒がしいけど、気にしないで。","It's a bit noisy, but don't worry。","É um pouco barulhento, mas não se preocupe。"
"32","って、勉強はどうした！\n俺は想い出話をしに来たわけじゃないぞ！","What happened to my studies！\nI didn't come here to talk about memories！","O que aconteceu com meus estudos！\nEu não vim aqui para falar sobre memórias！"
"33","でも、掃除のときなんかに\nうっかりなくさないように注意しないと。","But you have to be careful not to accidentally lose\nwhen cleaning。","Mas você precisa ter cuidado para não perder\nacidentalmente durante a limpeza。"
"34","ところで、先ほどそちらから\n『結婚式』という言葉が聞こえたのだが。","By the way, I heard the word\n“wedding” from there earlier。","A propósito, ouvi a palavra\n“casamento” de lá mais cedo。"
"35","どういうことか説明してもらいたい。","I want you to explain what that means。","Quero que explique o que isso significa。"
"36","どうして黙っているのかな？","Why are we silent？","Por que estamos em silêncio？"
"37","ねえ、フー君はどっちがいい？\n結婚式で使うなら、ネックレスか、ティアラか。\nもちろん別のものでもいいわ。","Hey, which one is better for you？\nIf you use it at a wedding, is it a necklace or a tiara？\nOf course, something else is fine。","Ei, qual é o melhor para você？\nSe você o usa em um casamento, é um colar ou uma tiara？\nClaro, outra coisa está bem。"
"38","は……。","is……。","é……。"
"39","はああぁぁ……。","huh ahhhhhhhh……","hein ahhhhhhhh……"
"40","はい、おかげさまで健康そのものです。","Yes, thanks to you, it's health itself。","Sim, graças a você, é a própria saúde。"
"41","は？　俺と？","What is？ With me？","O que é？ Comigo？"
"42","まだ夏休みは残ってるしさ。\n島での想い出話をするのもいいんじゃない？","I still have summer vacation left。\nIsn't it good to talk about memories on the island？","Ainda tenho férias de verão。\nNão é bom falar sobre memórias na ilha？"
"43","も、もちろんです！　当然じゃないですか！\n俺は紳士的に接していますとも！","Well, of course！ Isn't it natural！\nI'm treated like a gentleman！","Bem, claro！ Não é natural！\nSou tratado como um cavalheiro！"
"44","よくねぇ！\nほら、写真はどけろ！\n教科書とノートを持ってこい！","Well hey！\nLook, remove the picture！\nBring textbooks and notebooks！","Bem, ei！\nOlhe, remova a foto！\nTraga livros didáticos e cadernos！"
"45","らいはちゃんから頂いた水晶、\nひとまず私が受け取っていましたが、\nどうしましょう？","The crystal I received from Raiha-chan,\nfor now, I received it,\nWhat should I do？","O cristal que recebi de Raiha-chan,\npor enquanto, eu recebi,\nO que devo fazer？"
"46","ケチじゃない。\n俺はお前らの家庭教師だからな、\nこれが当然なんだよ。","It's not stingy。\nI'm your tutor,\nthis is It's natural。","Não é mesquinho。\nEu sou seu tutor,\nisso é natural。"
"47","スマホで撮ってたのをプリントしてみたの。\n島の想い出として、ちょうどいいでしょ？","I tried printing what I was shooting with my smartphone。\nIt's just right as a memory of the island, isn't it？","Tentei imprimir o que estava filmando com meu smartphone。\nÉ exatamente como uma lembrança da ilha, não é？"
"48","ラベル0","Label 0","Rótulo 0"
"49","一花","Ichika","Ichika"
"50","三玖","Sankaku","Sankaku"
"51","上杉さん、こういうのは難しく考えないで\n好きなほうを選べばいいんですって。","Uesugi-san, don't think hard about this kind of thing,\n, you should choose the one you like。","Uesugi-san, não pense muito sobre esse tipo de coisa,\n, você deve escolher o que você gosta。"
"52","上杉さーん！\n写真、まだまだありますよ。\nみんなで見ましょう。","Uesugi san！\nThere are still more photos。\nLet's all watch it。","Uesugi san！\nAinda há mais fotos。\nVamos assistir todos。"
"53","上杉君、ちょっといいですか？","Uesugi-kun, is it a little good？","Uesugi-kun, é um pouco bom？"
"54","上杉君、父となんの話を？\nもしかして、また何か……。","Uesugi-kun, what are you talking about with your father？\nDid you mean something again……。","Uesugi-kun, do que está falando com seu pai？\nVocê quis dizer algo de novo……。"
"55","中","midst","meio"
"56","中野父","Nakano Chu","Nakano Chu"
"57","二乃","Nino","Nino"
"58","二乃君の声だったと思うが、\n君との会話で、そのような単語が出てくる理由が\n思い当たらなくてね。","I think it was Nino-kun's voice, but I can't think of\nreason why such a word appears in a conversation with\n-kun。","Acho que era a voz de Nino-kun, mas não consigo pensar em\nrazão pela qual tal palavra apareça em uma conversa com\n-kun。"
"59","五月","May","Maio"
"60","出右","Izu","Izu"
"61","出左","Izusa","Izusa"
"62","前","previous","anterior"
"63","右","right","certo"
"64","右外","Right outside","Do lado de fora"
"65","君にお父さんと呼ばれる筋合いはないよ。","You don't deserve to be called dad。","Você não merece ser chamado de pai。"
"66","君は確かに、別荘にいたあいだも\n娘たちを正しく導いてくれたようだからね。","You certainly seem to have guided the\ndaughters correctly while you were in the villa。","Você certamente parece ter guiado as\nfilhas corretamente enquanto estava na vila。"
"67","四葉","Yotsuba","Yotsuba"
"68","妹さんの体調は、なんの問題もなくて幸いだったね。\nその後はどうかな？","I was fortunate that my sister didn't have any problems with her physical condition。\nWhat about after that？","Tive a sorte de minha irmã não ter problemas com sua condição física。\nE depois disso？"
"69","娘たちとは、あくまで家庭教師として、\n紳士的に接してくれていると信じていたのだが……。","…\n…","…\n…"
"70","島から戻ってからフータローと会ってなかったし、\n１人で寂しがってないかと思って。","I hadn't met\nsince I returned from the island, and I was wondering if I was lonely alone。","Eu não conhecia\ndesde que voltei da ilha, e eu estava me perguntando se eu estava sozinha sozinha。"
"71","左","left","esquerdo"
"72","左外","Sadai","Sadai"
"73","気の早い話を……。\nん、というか、お前ら、結婚式にまで\nらいはを呼ぶ気なのか。","A quick story……。\nor rather, do you guys want to call\nto the wedding？","Uma história rápida……。\nou melhor, vocês querem chamar\npara o casamento？"
"74","父が、あなたと代わってほしいそうです。","My father wants you to replace him。","Meu pai quer que você o substitua。"
"75","目がっかり:口がっかり:頬無し","Eyes disappointed: mouth disappointed: no cheeks","Olhos decepcionados: boca decepcionada: sem bochechas"
"76","目がっかり:口がっかり:頬無し:汗無し","Eyes disappointed: mouth disappointed: no cheeks: no sweat","Olhos decepcionados: boca decepcionada: sem bochechas: sem suor"
"77","目むくれ:口むくれ:頬むくれ","Swollen eyes: swollen mouth: swollen cheeks","Olhos inchados: boca inchada: bochechas inchadas"
"78","目むくれ:口むくれ:頬無し","Swollen eyes: swollen mouth: no cheeks","Olhos inchados: boca inchada: sem bochechas"
"79","目キョトン:口キョトン:頬無し","Eyes Kyoton: Mouth Kyoton: No cheeks","Olhos Kyoton: Boca Kyoton: Sem bochechas"
"80","目キョトン:口キョトン:頬無し:汗無し","Eyes Kyoton: Mouth Kyoton: No Cheeks: No Sweat","Olhos Kyoton: Boca Kyoton: Sem bochechas: Sem suor"
"81","目ニヤリ:口ニヤリ:頬無し","Eyes Grins: Mouth Grins: No Cheeks","Olhos sorrisos: boca sorri: sem bochechas"
"82","目哀しみ:口哀しみ:頬無し","Eyes sadness: mouth sadness: no cheeks","Tristeza nos olhos: tristeza na boca: sem bochechas"
"83","目哀しみ:口哀しみ:頬無し:汗無し","Eyes sadness: mouth sadness: no cheeks: no sweat","Tristeza nos olhos: tristeza na boca: sem bochechas: sem suor"
"84","目困惑:口困惑:頬無し","Eyes Puzzled: Mouth Puzzles: No Cheeks","Olhos intrigados: quebra-cabeças de boca: sem bochechas"
"85","目困惑:口困惑:頬無し:汗無し","Eye Puzzles: Mouth Puzzles: No Cheeks: No Sweat","Quebra-cabeças de olhos: quebra-cabeças de boca: sem bochechas: sem suor"
"86","目微笑:口微笑:頬無し","Eyes Smiling: Mouth Smiling: No Cheeks","Olhos sorrindo: boca sorrindo: sem bochechas"
"87","目微笑:口微笑:頬無し:汗無し","Eyes Smiling: Mouth Smiling: No Cheeks: No Sweat","Olhos sorrindo: boca sorrindo: sem bochechas: sem suor"
"88","目怒り:口怒り:頬無し","Eye anger: mouth rage: no cheek","Raiva ocular: raiva na boca: sem bochecha"
"89","目無表情:口無表情:頬無し","Eyes Expressionless: Mouth Expressionless: No Cheeks","Olhos sem expressão: boca sem expressão: sem bochechas"
"90","目無表情:口無表情:頬無し:汗無し","Eyes expressionless: no mouth expressionless: no cheeks: no sweat","Olhos sem expressão: sem boca sem expressão: sem bochechas: sem suor"
"91","目照れ微笑:口照れ微笑:頬照れ微笑","Shy smile: shy smile: shy smile","Sorriso tímido: sorriso tímido: sorriso tímido"
"92","目笑顔:口笑顔:頬無し","Eyes Smile: Mouth Smile: No Cheeks","Sorriso de olhos: sorriso na boca: sem bochechas"
"93","目苦笑:口苦笑:頬無し","A bitter smile: a bitter mouth smile: no cheeks","Um sorriso amargo: um sorriso amargo na boca: sem bochechas"
"94","目苦笑:口苦笑:頬無し:汗無し","Smiling eyes: bitter mouth smile: no cheeks: no sweat","Olhos sorridentes: boca amarga sorriso: sem bochechas: sem suor"
"95","目通常:口通常:頬無し","Eyes Normal: Mouth Normal: No Cheeks","Olhos normais: boca normal: sem bochechas"
"96","目驚き:口驚き:頬無し","Eye surprise: mouth surprise: no cheek","Surpresa ocular: surpresa na boca: sem bochecha"
"97","逃げられちゃったねー。","I was able to escape。","Consegui escapar。"
"98","風太郎","Futaro","Futaro"
"99","飾っておくのもいいかも。\nキッチンとか玄関とか、どうかな？","Maybe it's a good idea to display it。\nWhat about the kitchen or the entrance？","Talvez seja uma boa ideia exibi-lo。\nE a cozinha ou a entrada？"
"100","飾るのもいいけど、\nいっそアクセサリーに加工してもらって\n結婚式で使うってのもありじゃないかしら？","It's\nto decorate it, but I wonder if it's possible to have it processed into accessories and use it at\nwedding ceremony。","Não há\nem decorá-lo, mas gostaria de saber se é possível transformá-lo em acessórios e usá-lo em\ncerimônia de casamento。"
"101","（さっきのを聞かれたのか！\n　説明しろって言われても……）","（Did you ask me just now！\nEven if I'm told to explain……）","（Você me perguntou agora mesmo！\nMesmo que me digam para explicar…（…）"
"102","（なんの用だ？\n　もしかして、らいはを診てもらったことで\n　何か……）","（What is it for？\nCould it be that Raiha was examined\nSomething……）","（Para que serve？\nSerá que Raiha foi examinada （\n） Algo…（…）"
"103","（今回は見逃してくれたってことか？\n　それとも親父さんも多少は俺のことを……\n　いや、それはないよな……）","（Does that mean you missed it this time？\nor is my dad a little bit about me……\nNo, it's not there……）","（Isso significa que você perdeu desta vez？\nou meu pai é um pouco sobre mim……\nNão, não está lá……）"
"104","１日くらい、いいじゃない。\n夏休みはまだあるんだし。","Isn't it good for about a day。\nThere are still summer vacations。","Não é bom por cerca de um dia。\nAinda há férias de verão。"