"1","あ、ああ、よかったな。","Oh, oh, that's good。","Oh, oh, isso é bom。"
"2","いや……。","No,……。","Não,……。"
"3","おい！\nそんな竿を振ったら魚が逃げちまうぞ！","Hey！\nIf you shake such a pole, the fish will run away！","Ei！\nSe você sacudir esse poste, o peixe fugirá！"
"4","そうだな……。\n俺はまだ釣れてないけどな……ははは……。","That's right……。\nI haven't caught it yet……is……","Isso mesmo……。\nainda não peguei……é……"
"5","そして、今です！","And now it's！","E agora é！"
"6","そして右フェイント！！","And right feint！！","E finta certa！！"
"7","なかなか釣れませんねぇ。","It's hard to catch, isn't it？","É difícil de pegar, não é？"
"8","なっ！？","What！？","O que！？"
"9","はい、まだ竿は上げません！\n左フェイント！！","Yes, I haven't raised my rod yet！\nleft feint！！","Sim, eu não levantei minha vara ainda！\nfinta esquerda！！"
"10","ほうほう、なるほど！","Hoho, I see！","Hoho, eu vejo！"
"11","まず、魚が餌に食いついた手応えを感じても\nまだ竿は上げるな。","First of all, even if you feel the response of the fish to the bait,\nstill do not raise the rod。","Em primeiro lugar, mesmo que você sinta a resposta do peixe à isca,\nainda não levante a vara。"
"12","またまたゲットです！！","Get it again！！","Pegue de novo！！"
"13","む？　むむむっ！！\n竿に振動を感じます。\nこれは……来たかもしれませんよ！","Mu？ Mum mmm！！\nI feel a vibration in the rod。\nthis is……It may have come！","Mu？ Mãe mmm！\nSinto uma vibração na haste。\nisso é……Pode ter chegado！"
"14","やったぁ！　お魚ゲットです！","I did it！ It's time to get fish！","Eu fiz isso！ É hora de pegar peixe！"
"15","やつらが警戒を解き、\n針ごと餌に食らいついたときに――\n竿を引き上げる！","When they lift their vigilance and get eaten by every\nneedle —\nPull up the rod！","Quando eles levantam a vigilância e são comidos por cada\nagulha -\nPuxe a haste！"
"16","やつらは狡猾だ。\n餌の隅っこを食べているだけで\n本命の針にはたどり着いてない。","They are cunning。\n\nhaven't reached the needle of my favorite just by eating the corner of the bait。","Eles são astutos。\nNão\nà agulha do meu favorito apenas comendo o canto da isca。"
"17","よーし、じゃんじゃん釣っちゃいますよー！","Okay, I'm fishing for janjan！","Ok, eu estou pescando para Janjan！"
"18","わかってるな、四葉！","Do you know, Yotsuba！","Você sabe, Yotsuba！"
"19","ラベル0","Label 0","Rótulo 0"
"20","上杉さん、釣れましたか？","Did you catch Uesugi-san？","Você pegou Uesugi-san？"
"21","上杉さん！\nナイスなアドバイス、ありがとうございます！","Uesugi-san！\nThank you for your nice advice！","Uesugi-san！\nObrigado por seus bons conselhos！"
"22","上杉さん！　今日は大漁ですね！","Uesugi-san！ It's a big catch today！","Uesugi-san！ É uma grande pegadinha hoje！"
"23","中","midst","meio"
"24","出右","Izu","Izu"
"25","出左","Izusa","Izusa"
"26","右","right","certo"
"27","四葉","Yotsuba","Yotsuba"
"28","左","left","esquerdo"
"29","目がっかり:口がっかり:頬無し","Eyes disappointed: mouth disappointed: no cheeks","Olhos decepcionados: boca decepcionada: sem bochechas"
"30","目キョトン:口キョトン:頬無し","Eyes Kyoton: Mouth Kyoton: No cheeks","Olhos Kyoton: Boca Kyoton: Sem bochechas"
"31","目ニヤリ:口ニヤリ:頬無し","Eyes Grins: Mouth Grins: No Cheeks","Olhos sorrisos: boca sorri: sem bochechas"
"32","目哀しみ:口哀しみ:頬無し","Eyes sadness: mouth sadness: no cheeks","Tristeza nos olhos: tristeza na boca: sem bochechas"
"33","目困惑:口困惑:頬無し","Eyes Puzzled: Mouth Puzzles: No Cheeks","Olhos intrigados: quebra-cabeças de boca: sem bochechas"
"34","目怒り:口怒り:頬無し","Eye anger: mouth rage: no cheek","Raiva ocular: raiva na boca: sem bochecha"
"35","目無表情:口無表情:頬無し","Eyes Expressionless: Mouth Expressionless: No Cheeks","Olhos sem expressão: boca sem expressão: sem bochechas"
"36","目真剣:口真剣:頬無し","Eye Serious: Serious Mouth: No Cheek","Olho sério: boca séria: sem bochecha"
"37","目笑顔:口笑顔:頬無し","Eyes Smile: Mouth Smile: No Cheeks","Sorriso de olhos: sorriso na boca: sem bochechas"
"38","目苦笑:口苦笑:頬無し","A bitter smile: a bitter mouth smile: no cheeks","Um sorriso amargo: um sorriso amargo na boca: sem bochechas"
"39","目通常:口通常:頬無し","Eyes Normal: Mouth Normal: No Cheeks","Olhos normais: boca normal: sem bochechas"
"40","目驚き:口驚き:頬無し","Eye surprise: mouth surprise: no cheek","Surpresa ocular: surpresa na boca: sem bochecha"
"41","竿の先端の揺れ、水面の状態、そして海鳥の動き……\nすべてを読み切った者が勝つんだ。","The shaking of the tip of the rod, the state of the water surface, and the movement of seabirds……\nWhoever reads everything wins。","O tremor da ponta da haste, o estado da superfície da água e o movimento das aves marinhas……\nQuem lê tudo ganha。"
"42","自然と一体になりつつ、静かに待つ。\nそして魚との駆け引きを楽しむ……。\nそれが釣りの醍醐味。","Wait quietly while becoming one with nature。\nAnd enjoy playing with fish……。\nThat's the real thrill of fishing。","Espere calmamente enquanto se torna um com a natureza。\nE divirta-se brincando com peixes……。\nEssa é a verdadeira emoção da pesca。"
"43","読み切る、ですか？\n私には難しいかもしれませんけど、\nどうやるんでしょう？","Can you read it out？\nIt may be difficult for me, but\nhow You're going to do it, right","Você pode ler isso？\nPode ser difícil para mim, mas\ncomo você vai fazer isso, certo"
"44","釣りとはこういうもんだろ。","This is what fishing is like, isn't it？","É assim que é a pesca, não é？"
"45","風太郎","Futaro","Futaro"
"46","（あれから、かなり個性的な釣り方で\n　バンバン魚をゲットしてやがる……）","（From then on, I'm going to get\nbang bang fish with a pretty unique way of fishing……）","（A partir de então, eu vou pegar\nbang bang fish com uma maneira bastante única de pescar……）"
"47","（えー……なんでだ……）","（Eh……why……）","（Eh……porque……）"
"48","（最初は無茶苦茶すぎると思ったが、\n　ルアーのように、餌が生きているような動きを\n　してるから食いつきがいいのかもしれないな）","（At first I thought it was too crazy, but it moved like a\nlure, like a live bait （I'm doing\n, so maybe it's good to eat）","（No começo eu pensei que era muito louco, mas ele se moveu como uma isca\n, como uma isca viva （eu estou fazendo\n, então talvez seja bom comer）"